{ "v": 1, "id": "0192f1e4-7b3a-7c2e-9d11-5a4b6c7d8ea1", "type": "agent.logs.v1", "source": "agent:pc-casa", "target": "api",
  "ts": "2026-10-24T14:00:01Z", "correlationId": "0192f1e4-7b3a-7c2e-9d11-5a4b6c7d8e9f",
  "body": { "requestId": "0192f1e4-7b3a-7c2e-9d11-5a4b6c7d8ea0", "text": "2026-10-24 14:00:00,000 INFO uniover_agent: conectado\n2026-10-24 14:00:00,100 INFO uniover_agent: pronto", "lines": 2, "truncated": false, "at": "2026-10-24T14:00:01Z" } }
