{"v":1,"id":"0192f1e4-7b3a-7c2e-9d11-5a4b6c7d8e9f","type":"tv.livre.photo.v1","source":"api","target":"agent:pc-casa","ts":"2026-10-31T14:00:00Z","correlationId":null,"body":{"photoId":"0192f1e4-7b3a-7c2e-9d11-5a4b6c7d8ea1","index":0,"total":1,"sha256":"aaaaaaaaaaaaaaaaaaaaaaaaaaaaaaaaaaaaaaaaaaaaaaaaaaaaaaaaaaaaaaaa","data":"/9j/4AAQSkZJRg=="}}
