{ "v": 1, "id": "0192f1e4-7b3a-7c2e-9d11-5a4b6c7d8e9f", "type": "tv.apps.v1", "source": "agent:pc-casa", "target": "api",
  "ts": "2026-10-19T14:00:00Z", "correlationId": null, "body": {"apps":[{"package":"com.netflix.ninja","label":"Netflix"},{"package":"com.example.player","label":null}],"at":"2026-10-19T14:00:00Z"} }
