{ "v": 1, "id": "0192f1e4-7b3a-7c2e-9d11-5a4b6c7d8e9f", "type": "command.result.v1", "source": "agent:pc-casa", "target": "api",
  "ts": "2026-10-18T14:00:00Z", "correlationId": "0192f1e4-0000-7000-8000-000000000001", "body": { "ok": false, "error": { "code": "TV_UNREACHABLE", "message": "TV sem resposta" } } }
