{ "v": 1, "id": "0192f1e4-7b3a-7c2e-9d11-5a4b6c7d8ea2", "type": "agent.update.status.v1", "source": "agent:pc-casa", "target": "api",
  "ts": "2026-10-24T14:00:02Z", "correlationId": null,
  "body": { "outcome": "failed", "installedSha": "3f2a9c1d4e5b6a7988776655443322110fedcba9", "installedAt": "2026-10-20T09:15:00Z", "latestSha": "a1b2c3d4e5f60718293a4b5c6d7e8f9012345678", "checkedAt": "2026-10-24T14:00:00Z", "nextCheckAt": "2026-10-24T20:20:00Z", "previousSha": "0a1b2c3d4e5f60718293a4b5c6d7e8f901234567", "reason": "não consegui baixar o pacote (ConnectError)", "rolledBack": false } }
