{ "v": 1, "id": "0192f1e4-7b3a-7c2e-9d11-5a4b6c7d8ea1", "type": "tv.cleanup.result.v1", "source": "agent:pc-casa", "target": "api",
  "ts": "2026-10-20T14:00:12Z", "correlationId": "0192f1e4-7b3a-7c2e-9d11-5a4b6c7d8e9f",
  "body": {"requestId":"0192f1e4-7b3a-7c2e-9d11-5a4b6c7d8ea0","closedApps":6,"memoryBeforeMb":214,"memoryAfterMb":596,"freedMb":382,"failedSteps":["force-stop:com.example.player"],"at":"2026-10-20T14:00:12Z"} }
