{ "v":1,"id":"0192f1e4-7b3a-7c2e-9d11-5a4b6c7d8e9f","type":"tv.apps.v2","source":"agent:pc-casa","target":"api","ts":"2026-10-20T14:00:00Z","correlationId":null,"body":{"apps":[{"package":"com.netflix.ninja","label":"Netflix","icon":{"mime":"image/png","data":"iVBORw0KGgoAAAANSUhEUgAAAAQAAAAECAYAAACp8Z5+AAAAEklEQVR4nGN4yinyHxkzkC4AAD/YIBHrRBzaAAAAAElFTkSuQmCC"}},{"package":"com.example.player","label":null}],"at":"2026-10-20T14:00:00Z"}}
