{"v":1,"id":"0192f1e4-7b3a-7c2e-9d11-5a4b6c7d8e9f","type":"tv.livre.state.v1","source":"agent:pc-casa","target":"api","ts":"2026-10-31T14:00:00Z","correlationId":"0192f1e4-7b3a-7c2e-9d11-5a4b6c7d8ea0","body":{"requestId":"0192f1e4-7b3a-7c2e-9d11-5a4b6c7d8ea0","supported":true,"sdk":34,"installed":true,"version":"0.30.0","isHome":true,"factoryLauncher":"com.google.android.apps.tv.launcherx/.home.HomeActivity","disabledPackages":["com.example.bloat"],"apps":[{"package":"com.netflix.ninja","factory":false,"disabled":false},{"package":"com.example.bloat","factory":true,"disabled":true}],"at":"2026-10-31T14:00:00Z"}}
