{ "v": 1, "id": "0192f1e4-7b3a-7c2e-9d11-5a4b6c7d8e9f", "type": "tv.discovery.v1", "source": "agent:pc-casa", "target": "api",
  "ts": "2026-10-31T14:00:00Z", "correlationId": "0192f1e4-7b3a-7c2e-9d11-5a4b6c7d8ea1", "body": {"requestId":"0192f1e4-7b3a-7c2e-9d11-5a4b6c7d8ea0","tvs":[{"id":"a1b2c3d4e5f60718","kind":"samsung","name":"Samsung Sala","controlled":true},{"id":"f0e1d2c3b4a59687","kind":"android","name":null,"controlled":false}],"at":"2026-10-31T14:00:00Z"} }
